{
  "task_id": "task-001",
  "mission": "Create a robust OpenCode chat workflow using reflection and producer-critic pattern",
  "constraints": {
    "time_budget_s": 900,
    "style": "concise",
    "safety_level": "strict",
    "max_iterations": 4,
    "critic_score_threshold": 0.85
  },
  "smart_goals": [
    {
      "id": "G1",
      "specific": "Deliver role prompts and workflow files under .agent",
      "metric": "All required files created",
      "target": "100 percent",
      "realistic": true,
      "deadline": "within current session"
    },
    {
      "id": "G2",
      "specific": "Force structured outputs with explicit schemas",
      "metric": "Schema coverage",
      "target": "Producer, Critic, Final, Checkpoint",
      "realistic": true,
      "deadline": "within current session"
    }
  ],
  "expected_output_schema": "final_output.schema.json",
  "context": {
    "inputs": [
      "User request",
      "Existing .agent docs"
    ],
    "artifacts": [
      ".agent/instructions.md",
      ".agent/context.md"
    ],
    "history_summary": "Initial setup"
  }
}
